<?xml version='1.0' encoding='UTF-8'?>

<!ELEMENT tableau (ligne*)>
<!ELEMENT ligne (pays,medaille+,totalDeMedaille?)>
<!ELEMENT pays (EMPTY)>
<!ELEMENT medaille (#PCDATA)>
<!ELEMENT totalDeMedaille (#PCDATA)>


<!ATTLIST pays nomDePays (USA|GrandeBretagne|Chine|Russie|Allemagne|Japon|France|CorÃ©eduSud|Italie|Australie) #REQUIRED>
<!ATTLIST medaille typeDeMedaille (or|argent|bronze) #REQUIRED>
